{
  "schema_version": "2.0-rc1",
  "review_id": "review:2026-W38:publication:r2:d362f7d2765a18b4",
  "issue_id": "2026-W38",
  "gate": "PUBLICATION_PREVIEW",
  "revision": 2,
  "decision": "APPROVED",
  "reviewed_state": {
    "path": "sources/2026-W38/production-state.json",
    "sha256": "ee56f42caeb5e466c4dca9e398c2be9b8c33ea0ff70cfc6702384fcfbfc9ded4"
  },
  "reviewed_artifacts": [
    {
      "name": "publication-candidate",
      "path": "sources/2026-W38/publication/v2/publication-candidate-v2.json",
      "sha256": "f3fadf14e76ee884a798e1e0e9e17fad3e69a1ea8d81636e20bff2b1f58d7ca0"
    },
    {
      "name": "publication-pdf",
      "path": "surveys/weekly/2026-W38/main.pdf",
      "sha256": "3829c1660b55dbe808b3dec2ee14535bbba60ec6e5268f9a91276b71fae54933"
    }
  ],
  "reviewed_repository_commit_sha": "a55ac5b929221bd133d8a4b819bf960d2104d6c7",
  "reviewed_by": "Human Owner",
  "reviewed_at": "2026-09-19T10:44:21Z",
  "review_reference": "Human Owner explicit APPROVED of W38 Human Publication Preview r2 (reviewed a55ac5b929221bd133d8a4b819bf960d2104d6c7) per execution request sources/2026-W38/execution/requests/sol-w38-publication-preview-r2-approved-freeze-integrate-release-20260919.md; r2 shell sources/2026-W38/execution/reviews/publication-preview-r2.md + dossier sources/2026-W38/execution/reviews/publication-preview-r2-dossier.md; Independent Sol r2 review sources/2026-W38/execution/reviews/sol-w38-publication-preview-r2-independent-review-20260919.md (PASS / READY_FOR_HUMAN_PUBLICATION_PREVIEW); Human decision authority 2026-09-19 JST APPROVED; Issues #511/#512 independently verified fixed/closed",
  "requested_changes": null,
  "regeneration_boundary": null,
  "approval": {
    "path": "sources/2026-W38/gates/reviews/approvals/publication-r2.json",
    "sha256": "d77231121a49b356f953989fcdd5199a5f0b34c7ec09d220ae96a01d85d87558"
  }
}
